DATA_MANAGE_NO,DATA_TITLE_NM,THEME_NM,LWPRT_THEME_NM,CL_NM,LWPRT_CL_NM,SBJT_NM,MIDDL_SBJT_NM,SUMRY_CN,MAIN_THUMB_URL,CNTNTS_URL,CTPRVN_NM,SIGNGU_NM,ADDR,CTLSTT_LA,CTLSTT_LO,REGIST_DE,CORE_KWRD_CN,OPN_DE
10611,"우리나라에서 가장 오래된 천자문, 석각 천자문",역사문화유산,한국의 석조문화,문화유산,조각,조선시대 석조문화,암각화와 암각문,천자문은 예로부터 전해지는 한자공부의 기본서이다. 중국에서 제작된 『천자문』이 한반도에 전해졌던 시기를 정확히 알 수 없지만 현재까지 전해지고 있는  『천자문』은 대부분 조선시대에 만들어진 것으로 한자의 음과 뜻이 함께 쓰여 있다. 하지만 최근에 서울특별시 도봉구 도봉산에 위치한 영국사터에서 천자문이 새겨진 돌조각이 발견되었다. 새겨진 글씨체로 미루어 보아 고려시대에 제작된 것으로 추측된다. 그렇다면 영국사 석각 천자문은 우리나라에서 발견된 가장 오래된,,https://ncms.nculture.org/stonecraft/story/4882,서울특별시,송파구,서울 송파구 위례성대로 71,37.51542872,127.1208007,20200612,"석각 천자문, 천자문, 서울 영국사, 도봉구",20221230
10612,예약제로 관람할 수 있는 의정부 서계 박세당 사랑채,생활문화,한국의 가옥,생활과 민속,생활,경기도의 가옥,반가(양반집),"당쟁에 혐오를 느낀 박세당은 40세에 관료 생활을 청산하고 의정부시 장암동에 내려와서 직접 농사를 짓고 학문을 연구하며 제자들을 가르쳤다. 서계 박세당 고택은 안채를 비롯한 안사랑, 바깥사랑, 행랑채로 이루어진 사대부가의 주택이었다. 한국전쟁 당시 대부분 불에 타버렸으며, 지금 남아 있는 것은 바깥사랑채뿐이다. 서계 박세당 사랑채는 경기도문화재자료 제93호로 지정되었다.",https://minio.nculture.org/amsweb-opt/multimedia_assets/225/72625/66733/c/%EA%B2%BD%EA%B8%B0%EC%9D%98%EC%A0%95%EB%B6%80%EC%8B%9C-%EC%84%9C%EA%B3%84%EB%B0%95%EC%84%B8%EB%8B%B9%EC%82%AC%EB%9E%91%EC%B1%84-%EB%82%B4%EB%B6%80-%282%29-thumb.jpg,https://ncms.nculture.org/house/story/4894,경기도,의정부시,경기도 의정부시 동일로128번길 36,37.69977952,127.057643,20200613,"박세당, 사랑채, 의정부 서계, 서계 박세당 고택, 경기도 문화재",20221230
10613,"조선 중기 청백리의 표상, 광명 오리 이원익 종택",생활문화,한국의 가옥,생활과 민속,생활,경기도의 가옥,종가(종갓집),"오리 이원익 종택은 경기도 광명시 소하2동 영당말에 있다. 오리 이원익은 조선시대 영의정을 역임하였으며 청백리의 표상으로 존경받고 있다. 오리 이원익 종택은 본래 2칸 초가집이었으나 비가 샌다는 소리에 인조 임금이 관감정을 지어 하사했다. 관감정은 지금은 관감당이 되었다. 오리 이원익 종택은 현대식으로 개조한 곳도 있으나, 20세기 경기지역 살림집의 모습을 잘 보존했다는 평가를 받는다.",https://minio.nculture.org/amsweb-opt/multimedia_assets/52/85747/92947/c/광명-이원익종택-(1)_rev-thumb.jpg,https://ncms.nculture.org/house/story/4897,경기도,광명시,경기 광명시 오리로347번길 5-6 (소하동),37.4339273,126.8777258,20200613,"청백리, 광명 가옥, 이원익 종택, 인조, 오리 이원익",20221230
10614,동학군의 근거지였던 백산성,역사문화유산,한국의 관방문화,문화유산,건축유적,전라북도 관방유적,성곽,백산성은 사적 제409호로 고부와 부안으로 갈라지는 백산면 용계리 해발 47.4m의 낮은 산 위에 있다. 이 성은 언제 축조되었는지는 명확하지 않지만 백제가 멸망한 후 백제부흥군이 일본에 있던 왕자 부여풍을 맞아 왕으로 세우고 최후 항쟁을 하였던 곳이다. 또한 백산성은 1894년 갑오동학농민항쟁 때 동학군이 일어났던 역사적인 산성이기도 하다. 이 성은 토성으로 알려져 있으며 백산 정상부를 감싸고 축조되어 있다.,https://minio.nculture.org/amsweb-opt/3ds/65/84670/84670_thumbnail.jpg,https://ncms.nculture.org/fortress/story/4937,전라북도,부안군,전북 부안군 백산면 용계리 산8-1번지,35.72006124,126.8066255,20200622,"산성, 백제부흥군, 동학, 백산, 부여풍",20221230
10615,꽃담과 미닫이문 창살이 아름다운 성북동 이종석 별장,생활문화,한국의 가옥,생활과 민속,생활,서울의 가옥,민가(서민집),"서울 성북구 성북동에는 새우젓 장사로 부자가 된 이종석의 여름 별장이 있다. 이 별장은 1900년대에 건축한 것으로 추정되며, 현재는 덕수교회의 수양관으로 사용되고 있다. 거부의 별장답게 회색벽돌 꽃담, 마루로 연결된 미닫이문 창살, 늘어진 처마선과 마당의 갖가지 수목이 조화를 이루어 아름답다.",https://minio.nculture.org/amsweb-opt/multimedia_assets/68/85763/93089/c/이종석별장-(1)_rev-thumb.jpg,https://ncms.nculture.org/house/story/4945,서울특별시,성북구,서울특별시 성북구 성북로 131,37.5941126,126.9944686,20200622,"성북동, 이종석 별장, 마포 새우젓 장사, 여름 별장, 덕수교회",20221230
10616,민중의 모습을 새긴 소고리 마애불,역사문화유산,한국의 석조문화,문화유산,조각,불교 석조문화,석불,"소고리에 위치한 마애불은 단독의 마애여래좌상 1구와 그 아래 시대를 달리하는 삼존불좌상으로 이루어져 있다. 이곳 소고리는 경기도와 고려시대 개경을 연결하는 교통요지에 해당하는 곳으로, 전통적으로 중요 교통로 상에 사찰을 창건하고 불탑과 불상을 조성했던 전통에 따라 조성된 것으로 추정된다. 소고리 마애불상군은 마애여래좌상은 고려 중기 제작, 삼존불은 민간신앙과 불교가 결합된 형태의 조각상으로 불상의 개념보다는 민간신앙적 성격이 농후하다.",https://minio.nculture.org/amsweb-opt/multimedia_assets/234/72368/65358/c/이천-소고리-마애여래좌상_문화재청_제1유형-thumb.jpg,https://ncms.nculture.org/stonecraft/story/4999,경기도,이천시,경기도 이천시 모가면 진상미로 1295,37.17169942,127.4801748,20200624,"마애불, 이천 소고리, 마애여래좌상, 마애삼존불좌상",20221230
10617,고려의 평안을 염원하는 사천 흥사리 매향비,역사문화유산,한국의 기록문화,문화유산,기타,경상도 대구 울산 부산의 기록문화,금석자료,"경상남도 사천시 곤양면 흥사리에는 고려 말기에 세워진 사천 흥사리 매향비가 있다. 매향비는 향나무를 갯벌에 묻은 후 그 사연을 돌에 새겨 주변에 세운 비석을 말한다. 힘들고 고된 삶을 사는 민중들이 미륵세계를 염원하는 미륵신앙과 관련되어 있다. 사천 흥사리 매향비에는 4,100명의 사람들이 모여 나라의 태평과 백성의 평안을 기원하며 매향 의식을 치렀음이 기록되어 있다.",https://minio.nculture.org/amsweb-opt/multimedia_assets/245/72379/68345/c/%EC%82%AC%EC%B2%9C-%ED%9D%A5%EC%82%AC%EB%A6%AC-%EB%A7%A4%ED%96%A5%EB%B9%84%EB%AC%B8_%EB%AC%B8%ED%99%94%EC%9E%AC%EC%B2%AD_%EC%A0%9C1%EC%9C%A0%ED%98%95-thumb.jpg,https://ncms.nculture.org/archival/story/5020,경상남도,사천시,경남 사천시 곤양면 흥사리 836,35.08659396,128.0149624,20200626,"매향, 매향비, 미륵불, 침향, 미륵세계",20221230
10618,왕건의 여덟째 아들 욱이 묻혔다는 경남 사천의 성황당산성,역사문화유산,한국의 관방문화,문화유산,건축유적,경상남도 관방유적,성곽,"경상남도 사천시 정동면 예수리에 소재한 성황당산 정상부에 성황당산성이 있다. 성황당산성은 삼국시대 만들어진 것으로 추정하며, 사천읍성이 만들어지기 전까지 읍성의 역할을 했던 곳이다. 이 산성이 있는 주변 마을에는 성황당산성 안에 왕건의 여덟째 아들인 왕욱의 무덤이 있었다는 이야기가 전해진다. 산성 안에 서낭신을 모시는 성황당이 있고, 이곳에서 매년 사천시민의 평안과 사천시의 발전을 기원하는 ‘성화당산성 산신제’가 열린다.",https://minio.nculture.org/amsweb-opt/multimedia_assets/108/73320/71688/c/왕건의-여덟째-아들-욱이-묻혔다는-경남-사천의-성황당산성-thumb.jpg,https://ncms.nculture.org/fortress/story/5066,경상남도,사천시,경남 사천시 정동면 예수리 산 45-1,35.05761627,128.0987651,20200629,"고읍성, 왕욱, 헌종, 왕건, 사천, 성황당산성, 성황당산",20221230
10619,"우리나라에서 가장 오래된 금동불상, 금동연가7년명여래입상",역사문화유산,한국의 기록문화,문화유산,기타,경상도 대구 울산 부산의 기록문화,금석자료,"1963년 경상남도 의령군에서 출토된 「금동연가7년명여래입상」은 539년에 고구려에서 만들어진 천불상이다. 우리나라에서 가장 오래된 금동불상으로, 광배의 뒷면에는 4행 47자의 글자가 음각되어 있다. 이를 통해 불상의 주조 시기와 천불상의 하나로 주조되었다는 사실을 알 수 있다. 이 불상이 만들어질 당시 고구려에서는 금동불상을 조성하여 유포하는 거대한 불교 사업이 진행 중이었던 것으로 추정된다.",,https://ncms.nculture.org/archival/story/5069,서울특별시,용산구,서빙고로 137,37.52470224,126.9777402,20200629,"의령군, 금동연가7년명여래입상, 천불상, 천불신앙",20221230
10620,헌종과 경빈 김씨의 혼례를 기록한 정미가례시일기,역사문화유산,한국의 기록문화,문화유산,기타,서울의 기록문화,종이자료,"『정미가례시일기』는 헌종 13년에 헌종과 후궁 경빈 김 씨의 가례와 관련하여 혼례 절차와 가례에 쓰인 물품의 목록 등을 한글로 기록한 책이다. 가례의 절차와 궁녀들의 역할 분담, 가례에서 사용된 물품들을 상세하게 기록했기 때문에 궁중 풍속 연구에 있어서 중요한 자료로 쓰일 수 있다. 조선의 왕과 후궁의 가례는 여러 번 있었지만, 기록으로 남은 건 두번 뿐이며 헌종과 경빈 김씨의 가례를 다룬 기록이 가장 상세하다.",,https://ncms.nculture.org/archival/story/5076,서울특별시,관악구,관악로 1(신림동) 서울대학교 규장각 한국학연구원,37.46803806,126.9592943,20200629,"헌종, 경빈김씨, 가례, 정미가례시일기, 경빈가례시가례청등록",20221230
10621,"부마의 집, 성북구 장위동 김진흥 가옥",생활문화,한국의 가옥,생활과 민속,생활,서울의 가옥,반가(양반집),"서울 성북구 장위동 김진흥 가옥은 조선 제23대 순조의 셋째 사위인 남령위 윤의선이 지은 집이라고도 하고, 제27대 순종의 부마가 살던 집이라고도 한다. 따라서 가옥의 건축연대는 1865년과 1925년으로 나뉜다. 상류 주택의 격식이 잘 갖추어진 집으로, 서울특별시 민속자료 제25호로 지정되었다. 성북구는 여기서 시민들이 참여하는 전통 혼례식과 성년식을 개최하였다.",https://minio.nculture.org/amsweb-opt/multimedia_assets/247/72926/69023/c/장위동-김진흥가옥-내부_문화재청_제1유형-thumb.jpg,https://ncms.nculture.org/house/story/5103,서울특별시,성북구,서울특별시 성북구 돌곶이로34길 4-11,37.61619131,127.0519661,20200705,"덕온공주, 윤의선, 성북구 장위동, 김진흥 가옥, 윤용구",20221230
10622,"부평계양문화권의 역사적 뿌리이자 산소탱크, 계양산",생활문화,지명유래,"구비전승,어문학",지명유래,인천 지역의 지명유래,,"인천 계양구의 계양산은 시대에 따라 수주악, 안남산, 아남산, 경명산이라고도 하였다. 한강 서부지역에서 가장 높은 계양산은 예로부터 계양산 자락의 마을에서 산신제나 마을 제례를 하며 신성시되었다.",,https://ncms.nculture.org/origin-of-place-names/story/5114,인천광역시,계양구,인천 계양구 계산동 산 52,37.55060069,126.7142619,20200707,"안남산, 인천의 산, 경명산",20221230
10623,강원도 옥수수로 만드는 황골엿과 황골 엿술,생활문화,향토음식,생활과 민속,생활,지역 향토 음식,,옥수수엿은 강원도 원주시 황골마을의 향토음식으로 100~140년 전부터 만들어왔다. 황골엿이라고도 부른다. 간 옥수수를 죽처럼 푹 끓여 엿기름가루를 넣어 잘 혼합해서 삭힌다. 8시간 정도 지나면 윗부분에 맑은 물이 생긴다. 전체를 다 떠서 삼베 주머니에 눌러 짜주고 물만 따로 받아서 식기 전에 솥에 붓고 은근한 불을 잘 조절해 졸이면 엿이 완성된다. 이 엿물을 고아서 만드는 술이 황골 엿술이다. 황골 엿술은 붉은빛을 띤 담황색으로 엿기름의 달콤한 맛과,,https://ncms.nculture.org/food/story/5158,강원도,원주시,강원 원주시 소초면 황골로 172,37.38207838,127.9958713,20200708,"옥수수, 원주, 옥수수엿, 엿술",20221230
10624,불교에 대한 인문학적 지식이 현학적으로 기록된 계룡산 갑사 사적비,역사문화유산,한국의 기록문화,문화유산,기타,충청도 대전 세종의 기록문화,금석자료,"충청남도 공주시 계룡면 갑사로에는 갑사(岬寺) 사적비가 세워져 있다. 이 비석은 갑사의 역사에 대해 소상히 기록하고 있다. 또한 갑사의 운영에 도움을 준 관료, 비석 제작에 관련한 인물들을 기록하였다. 불교의 역사와 사상적 특징 등에 대한 해박한 지식을 바탕으로 작성되었으며, 수사적 표현이 많고 다양한 전고들을 활용하였다는 점이 특징이다. 효종 10년인 1659년에 건립하여 오늘날까지 전해지고 있다.",https://minio.nculture.org/amsweb-opt/multimedia_assets/144/72528/65682/c/계룡산-갑사-사적비_문화재청_제1유형-(1)-thumb.jpg,https://ncms.nculture.org/archival/story/5173,충청남도,공주시,충남 공주시 계룡면 갑사로 567-3,36.36607983,127.1864456,20200708,"계룡산, 갑사, 사적비",20221230
10625,"병자호란 속 가족을 피난시켰던 여성의 기록, 남평조씨 병자일기",역사문화유산,한국의 기록문화,문화유산,기타,충청도 대전 세종의 기록문화,종이자료,"충청남도 공주시에 있는 국립공주박물관에는 『병자일기』가 소장되어 있다. 『병자일기』는 병자호란 당시 남이웅(南以雄)의 부인인 조애중(曺愛重)이 병자호란의 경험을 바탕으로 쓴 일기이다. 1636년 12월 16일부터 1640년 8월 9일까지의 기록을 담고 있다. 오늘날 전하는 여성 작가의 한글 일기 중 창작연대가 밝혀진 최초의 작품이다. 또한, 전란 당시 민간의 생활사를 소상히 담고 있다는 점에서 문화적 가치가 매우 높다.",https://minio.nculture.org/amsweb-opt/multimedia_assets/102/72485/65590/c/남평조씨-병자일기-속지_문화재청_제4유형-thumb.jpg,https://ncms.nculture.org/archival/story/5176,충청남도,공주시,충남 공주시 관광단지길 34,36.46552912,127.1121799,20200708,"병자호란, 공주사대부가여성, 남평조씨, 병자일기",20221230
10626,"자녀를 원하는 사람들의 기도처, 안양 삼막사 남녀근석",역사문화유산,한국의 석조문화,문화유산,조각,생활/민속 석조문화,입석/선바위/미륵바위,"성기숭배는 남녀의 생식기를 닮은 바위에 종교적 의미를 부여하여 숭배하는 민속신앙의 한 형태이다. 성기숭배의 형태는 남근숭배, 여근숭배, 남녀근숭배 등으로 나타난다. 성기숭배는 자녀기원과 자손의 행운을 기원하는 것과 마을의 풍농?평안, 해상의 안전?풍어를 기원하는데 목적이 있다. 삼막사 남녀근석은 신라 문무왕때 원효대사가 삼막사를 세우기 이전부터 신앙의 대상이었다. 삼막사 남녀근석에는 지금도 사월초파일과 칠월칠석이 되면 인근에서 사람들이 올라와 자녀출산과",https://minio.nculture.org/amsweb-opt/multimedia_assets/73/73274/71541/c/%EC%9E%90%EB%85%80%EB%A5%BC-%EC%9B%90%ED%95%98%EB%8A%94-%EC%82%AC%EB%9E%8C%EB%93%A4%EC%9D%98-%EA%B8%B0%EB%8F%84%EC%B2%98%EC%9D%B8-%EA%B2%BD%EA%B8%B0%EB%8F%84-%EC%95%88%EC%96%91%EC%8B,https://ncms.nculture.org/stonecraft/story/5180,경기도,안양시,경기 안양시 만안구 삼막로 478,37.43461184,126.9361391,20200709,"남녀근석, 성기숭배, 자녀기원, 민속신앙, 기자신앙, 안양 삼막사",20221230
10627,옥정지구 택지개발로 선돌근린공원으로 옮겨진 양주옥정리선돌,역사문화유산,한국의 석조문화,문화유산,조각,생활/민속 석조문화,입석/선바위/미륵바위,"양주옥정리선돌은 경기도 양주시 옥정동 616번지 선돌근린공원 내에 있다. 옥정동이라는 지명은 옥동리의 ’구슬 옥(玉)‘자와 냉정리의 ’우물 정(井)‘자에서 차용한 것이다. 옥정리 선돌은 옥정리 입구 구릉 하단부에 두 개의 선돌이 마주보고 있었다. 선돌은 납작한 사각형 돌에 끝이 뾰족한 기둥의 형태이다. 옥정리에는 옥정리 선돌 외에도 청동기 시대의 옥정리 지석묘, 원삼국 시대의 옥정리 유물산포지 2곳, 삼국시대의 옥정리 야철지와 독바위 보루성, 조선시대의",https://minio.nculture.org/amsweb-opt/3ds/167/84522/84522_thumbnail.jpg,https://ncms.nculture.org/stonecraft/story/5184,경기도,양주시,경기 양주시 옥정동 616,37.82143033,127.0811476,20200709,"지석묘, 유물산포지, 독바위보루, 한근수사당, 양주 옥정리, 선돌근린공원",20221230
10628,주왕산의 이야기를 모은 경북 청송 주왕산지,역사문화유산,한국의 기록문화,문화유산,기타,경상도 대구 울산 부산의 기록문화,종이자료,"경상북도 청송군 주왕산면 상의리에는 주왕산이라는 유명한 산이 있다. 조선 후기 청송군 출신의 학자 서원모는 주왕산과 관련된 기록들을 모아 『주왕산지』라는 책을 만들었다. 『주왕산지』에는 주왕 설화, 유람 기록, 시, 주왕산 관련 지명 등이 수록되어 있다. 주왕산이라는 명칭에 대하여 당나라 때 스스로를 주왕이라 일컫고 장안을 공격했던 인물 주왕에 얽힌 이야기가 전해진다. 2009년에는 한글로 번역된 『주왕산지』(청송군)가 출간되어 일반인들도 쉽게 접할 수",,https://ncms.nculture.org/archival/story/5211,경상북도,청송군,경북 청송군 주왕산면 공원길 169-7,36.39387229,129.1420635,20200710,"주왕산지, 주왕산, 청송군",20221230
10629,경남 밀양의 풀 썰며 부르는 작두야소리,생활문화,노동요,생활과 민속,민속,경상남도 노동요,임산노동요,"「풀써는소리」는 논이나 밭에 거름으로 쓸 풀을 작두로 썰면서 부르던 노래이다. 풀 써는 일은 넣어주고, 밟고, 빼는 등 분업으로 진행했는데, 보통은 풀을 작두에 넣어주는 사람이 「풀써는소리」를 부른다. 현재까지 전승이 확인된 「풀써는소리」에는 어이야소리, 우러리소리, 작두야소리가 있다. 작두야소리는 밀양시 산내면에서 전승되었다. 가창방식은 선후창으로 2마디짜리 전언가사에 ‘어허허어 작두야’라는 디딤가사를 붙였다.",,https://ncms.nculture.org/labour-song/story/5221,경상남도,밀양시,경상남도 밀양시 산내면 발례로 65,35.56865435,128.8792697,20200710,"경상남도, 밀양, 풀써는소리, 임산물채취요, 작두야소리",20221230
10630,국내 유일하게 경남 사천에서 전승되는 갈방아소리,생활문화,노동요,생활과 민속,민속,경상남도 노동요,공산노동요,"경상남도 사천시에서는 갈방아를 찧을 때 갈방아소리를 불렀다. 갈은 소나무껍질로, 나일론이 나오기 전까지 갈을 찧어 면사 그물에 묻혀 튼튼하게 만들었다고 한다. 갈방아 찧기는 남자들 4~5명이 모여 함께 작업을 했으며 이때의 노래는 작업자 간의 호흡을 일치시키고 흥을 돋우기 위해서 불렀다. 갈방아소리는 2마디짜리 전언가사에 “에야디야 갈방애야”라는 디딤가사를 선후창으로 불렀다. 「갈방아찧는소리」로는 사천 마도동에서 채록된 갈방아소리가 유일하다.",,https://ncms.nculture.org/labour-song/story/5222,경상남도,사천시,경상남도 사천시 마도길 47,34.93736037,128.0304742,20200710,"갈방아찧는소리, 갈방아소리, 경남 사천, 소나무 껍질",20221230
10631,미군 레이더 기지로 운영되면서 없어진 철원 소이산 봉수,역사문화유산,한국의 관방문화,문화유산,건축유적,강원도 관방유적,봉수,"강원도 철원군 철원읍 사요리에 있는 소이산(324m) 정상에 봉수대가 있었다. 소이산 정상에 오르면 철원평야가 사방으로 넓게 퍼져 있으며, 대응봉수와 연락을 취하기에 가장 좋은 위치임을 알 수 있다. 소이산 봉수는 『세종실록지리지』에도 기록되어 있으며, 함경도로부터 서울까지 이어지는 내지봉수였다. 대응봉수는 북으로 토빙산 봉수(吐氷山烽燧)에 응하고 남으로 할미산 봉수에 응했다.",https://minio.nculture.org/amsweb-opt/3ds/127/84482/84482_thumbnail.jpg,https://ncms.nculture.org/fortress/story/5279,강원도,철원군,강원 철원군 철원읍 사요리 산 1,38.25507722,127.1879754,20200721,"소이산봉수, 백마고지, 노동당사, 미군레이더기지",20221230
10632,서양식 별자리가 새겨진 석각천문도,역사문화유산,한국의 석조문화,문화유산,조각,조선시대 석조문화,기타,"동양 전통의 세계관에서 세상 만물을 이루는 하늘과 땅 그리고 사람[天·地·人]은 모두 유기적으로 연결되어 있다. 군주는 인(人)뿐만 아니라 지(地)와 천(天) 분야에도 두루 관심을 보였고, 지도와 천문도 제작은 군주의 중요한 정치적 행위였다. 대전 유성구의 석각천문도(石刻天文圖)는 기존의 천문도와는 다르게 서양의 별자리가 새겨져있다. 중앙의 동심원으로 천구(天球)를 표현하는 것이나 테두리에 열두 간지에 따른 12시를 표현하는 방법은 동양의 전통을 따르고",,https://ncms.nculture.org/stonecraft/story/5318,대전광역시,유성구,대전 유성구 대덕대로 481,36.3771312,127.3749897,20200722,"석각천문도, 천문도, 별자리, 천상열차분야지도, 석각, 일제강점기",20221230
10633,"불을 밝히고 손을 씻으며 제향(祭享)을 준비하다, 소수서원 정료대·관세대",역사문화유산,한국의 석조문화,문화유산,조각,조선시대 석조문화,서원 석물,"소수서원은 우리나라의 최초의 서원이다. 처음에는 백운동 서원으로 설립되었으나 신광한에 의해 소수서원이라는 명칭을 갖게 되었으며, 명종이 직접 “소수서원”이라는 편액 글씨를 써서 하사하기도 하였다.  지난 2018년 7월에는 소수서원을 비롯한 우리나라의 서원 9곳이 유네스코 세계문화유산에 등재되었다. 소수서원에 남아있는 정료대와 관세대는 제향을 하기 전 불을 밝히고, 손을 씻는 곳으로 서원에서 머물며 공부했던 옛 사람들의 자연스러운 생활 모습이 담겨있는",,https://ncms.nculture.org/stonecraft/story/5319,경상북도,영주시,경북 영주시 순흥면 내죽리,36.93571553,128.5755851,20200722,"소수서원, 정료대, 관세대, 서원 석조물, 제향",20221230
10634,이익의 학문과 사상을 담은 경남 밀양 성호선생문집 책판,역사문화유산,한국의 기록문화,문화유산,기타,경상도 대구 울산 부산의 기록문화,목재자료,1917년 경상남도 밀양시 부북면 퇴로리에서 성호 이익의 문집을 간행하기 위한 책판이 제작되었다. 성호 이익은 실용적인 학문을 주장한 조선 후기의 실학자이다. 성호선생문집은 1774년 70권으로 간행되었다. 1800년대에 재편되어 여러 차례 간행이 시도되었으나 거듭 실패를 겪다가 1917년에 50권으로 간행되었다. 성호선생문집책판은 밀양시립박물관에 소장되어 있다.,https://minio.nculture.org/amsweb-opt/multimedia_assets/6/72390/65400/c/이익-성호전집-목판_문화재청_제1유형-thumb.jpg,https://ncms.nculture.org/archival/story/5328,경상남도,밀양시,"경남 밀양시 밀양대공원로 100 밀양시립박물관,독립운동기념관",35.50296509,128.7593643,20200723,"성호, 이익, 성호선생문집, 퇴로리, 밀양시립박물관",20221230
